{
  "ids": [
    "CVE-2023-51074",
    "GHSA-pfh2-hfmq-phg5"
  ],
  "versions": "all",
  "jars": [
    "json-path-2.8.0.jar"
  ],
  "analysis": {
    "state": "not_affected",
    "detail": "The only places we use json-path is for querying (via Calcite) and for transforming/indexing custom JSON. Since the advisory describes a problem that is limited to the current thread, and users that are allowed to query/transform/index are already trusted to cause load to some extent, this advisory does not appear to have impact on the way json-path is used in Solr."
  }
}
