{
  "ids": [
    "CVE-2016-6809",
    "CVE-2018-1335",
    "CVE-2018-1338",
    "CVE-2018-1339"
  ],
  "versions": "5.5.5, 6.2.0-today",
  "jars": [
    "vorbis-java-tika-0.8.jar"
  ],
  "analysis": {
    "state": "not_affected",
    "detail": "See https://github.com/Gagravarr/VorbisJava/issues/30; reported CVEs are not related to OggVorbis at all."
  }
}
