{
  "ids": [
    "CVE-2014-7940",
    "CVE-2016-6293",
    "CVE-2016-7415",
    "CVE-2017-14952",
    "CVE-2017-17484",
    "CVE-2017-7867",
    "CVE-2017-7868"
  ],
  "versions": "7.3.1",
  "jars": [
    "lucene-analyzers-icu-7.3.1.jar"
  ],
  "analysis": {
    "state": "not_affected",
    "detail": "All of these issues apply to the C++ release of ICU and not ICU4J, which is what Lucene uses."
  }
}
