{
  "ids": [
    "CVE-2018-1471"
  ],
  "versions": "5.4.0-7.7.2, 8.0-8.3",
  "jars": [
    "simple-xml-2.7.1.jar"
  ],
  "analysis": {
    "state": "not_affected",
    "detail": "Dependency of Carrot2 and used during compilation, not at runtime (see SOLR-769. This .jar was replaced in Solr 8.3 and backported to 7.7.3 (see SOLR-13779)."
  }
}
