{
  "ids": [
    "CVE-2014-0114"
  ],
  "versions": "4.9.0-7.5.0",
  "jars": [
    "commons-beanutils-1.8.3.jar"
  ],
  "analysis": {
    "state": "not_affected",
    "detail": "This is only used at compile time and it cannot be used to attack Solr. Since it is generally unnecessary, the dependency has been removed as of 7.5.0. See SOLR-12617."
  }
}
