{
  "ids": [
    "CVE-2019-10086"
  ],
  "versions": "8.0.0-8.3.0",
  "jars": [
    "commons-beanutils-1.9.3.jar"
  ],
  "analysis": {
    "state": "not_affected",
    "detail": "While commons-beanutils was removed in 7.5, it was added back in 8.0 in error and removed again in 8.3. The vulnerable class was not used in any Solr code path. This jar remains a dependency of both Velocity and hadoop-common, but Solr does not use it in our implementations."
  }
}
