{
  "ids": [
    "CVE-2020-13955"
  ],
  "versions": "8.1.0- today",
  "jars": [
    "avatica-core-1.13.0.jar",
    "calcite-core-1.18.0.jar"
  ],
  "analysis": {
    "state": "not_affected",
    "detail": "Solr's SQL adapter does not use the vulnerable class \"HttpUtils\". Calcite only used it to talk to Druid or Splunk."
  }
}
