{
  "ids": [
    "CVE-2021-45105",
    "CVE-2021-45046"
  ],
  "versions": "7.4-8.11.1",
  "jars": [
    "log4j-core-2.14.1.jar",
    "log4j-core-2.16.0.jar"
  ],
  "analysis": {
    "state": "not_affected",
    "detail": "The MDC data used by Solr are for the collection, shard, replica, core and node names, and a potential trace id, which are all sanitized. Furthermore, Solr's default log configuration doesn't use double-dollar-sign and we don't imagine a user would want to do that."
  }
}
