{
  "ids": [
    "CVE-2018-8088"
  ],
  "versions": "4.x-today",
  "jars": [
    "slf4j-api-1.7.24.jar",
    "jcl-over-slf4j-1.7.24.jar",
    "jul-to-slf4j-1.7.24.jar"
  ],
  "analysis": {
    "state": "not_affected",
    "detail": "The reported CVE impacts org.slf4j.ext.EventData, which is not used in Solr."
  }
}
