{
  "ids": [
    "CVE-2017-14868",
    "CVE-2017-14949"
  ],
  "versions": "5.2.0-today",
  "jars": [
    "org.restlet-2.3.0.jar"
  ],
  "analysis": {
    "state": "not_affected",
    "detail": "Solr should not be exposed outside a firewall where bad actors can send HTTP requests. These two CVEs specifically involve classes (SimpleXMLProvider and XmlRepresentation, respectively) that Solr does not use in any code path."
  }
}
