{
  "ids": [
    "CVE-"
  ],
  "versions": "7.3.1-today",
  "jars": [
    "tika-core.*.jar"
  ],
  "analysis": {
    "state": "not_affected",
    "detail": "All Tika issues that could be Solr vulnerabilities would only be exploitable if untrusted files are indexed with SolrCell. This is not recommended in production systems, so Solr does not consider these valid CVEs for Solr."
  }
}