{
  "ids": [
    "CVE-2017-14952"
  ],
  "versions": "6.0.0-7.5.0",
  "jars": [
    "icu4j-56.1.jar",
    "icu4j-59.1.jar"
  ],
  "analysis": {
    "state": "not_affected",
    "detail": "Issue applies only to the C++ release of ICU and not ICU4J, which is what Lucene uses. ICU4J is at v63.2 as of Lucene/Solr 7.6.0"
  }
}
