{
  "ids": [
    "CVE-2019-10241",
    "CVE-2019-10247"
  ],
  "versions": "7.7.0-8.2",
  "jars": [
    "jetty-9.4.14"
  ],
  "analysis": {
    "state": "not_affected",
    "detail": "Solr upgraded to Jetty 9.4.19 for the 8.2 release. Additionally, the path to exploit these vulnerabilities was fixed in 8.1 and 7.7.2. Earlier versions can manually patch their configurations as described in SOLR-13409."
  }
}
