{
  "ids": [
    "CVE-2019-16869"
  ],
  "versions": "8.2-8.3",
  "jars": [
    "netty-all-4.1.29.Final.jar"
  ],
  "analysis": {
    "state": "not_affected",
    "detail": "This is not included in Solr but is a dependency of ZooKeeper 3.5.5. The version was upgraded in ZooKeeper 3.5.6, included with Solr 8.3. The specific classes mentioned in the CVE are not used in Solr (nor in ZooKeeper as far as the Solr community can determine)."
  }
}
