{
  "ids": [
    "CVE-2024-51504"
  ],
  "versions": "9.4.0â€“9.8.1",
  "jars": [
    "zookeeper-3.9.0.jar",
    "zookeeper-3.9.1.jar",
    "zookeeper-3.9.2.jar"
  ],
  "analysis": {
    "state": "not_affected",
    "justification": "requires_configuration",
    "detail": "Solr production deployments are unlikely to be affected.\nExploitation requires Solr to run in SolrCloud mode with the embedded (non-production) Zookeeper server.\nIt also requires the Zookeeper Admin Server to be manually enabled in the configuration."
  }
}
