{
  "ids": [
    "CVE-2021-44832"
  ],
  "versions": "7.4-8.11.1",
  "jars": [
    "log4j-core-2.14.1.jar",
    "log4j-core-2.16.0.jar"
  ],
  "analysis": {
    "state": "not_affected",
    "detail": "Solr's default log configuration doesn't use JDBCAppender and we don't imagine a user would want to use it or other obscure appenders."
  }
}
